{
  "$schema": "http://json-schema.org/draft-07/schema#",
  "title": "impact-{season}.json 错漏判影响标注契约",
  "type": "object",
  "required": ["scope", "type_labels", "swing", "match_notes", "impacts"],
  "properties": {
    "scope": {"type": "array", "items": {"type": "string"}},
    "type_labels": {"type": "object"},
    "swing": {"type": "object"},
    "match_notes": {"type": "object"},
    "impacts": {
      "type": "object",
      "additionalProperties": {
        "type": "object",
        "required": ["league", "round", "home", "away", "issue", "case_no", "items"],
        "properties": {
          "league": {"type": "string", "minLength": 1},
          "round": {"type": "integer"},
          "home": {"type": "string", "minLength": 1},
          "away": {"type": "string", "minLength": 1},
          "issue": {"type": "integer"},
          "case_no": {"type": "integer"},
          "match_note": {"type": "string"},
          "items": {
            "type": "array",
            "minItems": 1,
            "items": {
              "type": "object",
              "required": ["team", "type", "swing", "note"],
              "properties": {
                "team": {"type": "string", "minLength": 1},
                "type": {"enum": ["denied_goal", "opp_goal_should_disallow",
                                  "missed_penalty", "wrong_penalty_against",
                                  "missed_red_opponent", "wrong_red_self",
                                  "missed_yellow_opponent", "wrong_yellow_self",
                                  "wrong_foul_called_self", "wrong_offside_self"]},
                "swing": {"enum": [1, -1, 0]},
                "note": {"type": "string"}
              }
            }
          }
        }
      }
    }
  }
}
