{
 "scope": [
  "中超联赛",
  "中甲联赛",
  "中乙联赛",
  "中国足协杯"
 ],
 "type_labels": {
  "denied_goal": "漏判进球（应有效）",
  "opp_goal_should_disallow": "对方进球应无效",
  "missed_penalty": "漏判点球（机会）",
  "wrong_penalty_against": "错判点球",
  "missed_red_opponent": "漏判对方红牌",
  "wrong_red_self": "错判本队红牌",
  "missed_yellow_opponent": "漏判对方黄牌",
  "wrong_yellow_self": "错判本队黄牌",
  "wrong_foul_called_self": "错判犯规",
  "wrong_offside_self": "误判越位"
 },
 "swing": {
  "denied_goal": 1,
  "opp_goal_should_disallow": -1
 },
 "match_notes": {},
 "impacts": {
  "1": {
   "league": "中超联赛",
   "round": 2,
   "home": "山东泰山",
   "away": "北京国安",
   "issue": 1,
   "case_no": 1,
   "match_note": "",
   "items": [
    {
     "team": "北京国安",
     "type": "missed_penalty",
     "swing": 0,
     "note": "山东泰山8号手臂抬起使身体不自然扩大触球，漏判手球犯规和点球"
    }
   ]
  },
  "2": {
   "league": "中甲联赛",
   "round": 1,
   "home": "深圳青年人",
   "away": "陕西联合",
   "issue": 1,
   "case_no": 2,
   "match_note": "",
   "items": [
    {
     "team": "陕西联合",
     "type": "missed_penalty",
     "swing": 0,
     "note": "深圳青年人42号铲球草率绊倒7号，应判点球"
    },
    {
     "team": "陕西联合",
     "type": "wrong_yellow_self",
     "swing": 0,
     "note": "7号被错判佯装出示黄牌"
    }
   ]
  },
  "3": {
   "league": "中超联赛",
   "round": 3,
   "home": "河南俱乐部",
   "away": "武汉三镇",
   "issue": 2,
   "case_no": 1,
   "match_note": "",
   "items": [
    {
     "team": "河南俱乐部",
     "type": "missed_penalty",
     "swing": 0,
     "note": "武汉三镇8号犯规接触点在罚球区内，应判点球"
    }
   ]
  },
  "4": {
   "league": "中超联赛",
   "round": 4,
   "home": "辽宁铁人",
   "away": "北京国安",
   "issue": 2,
   "case_no": 2,
   "match_note": "",
   "items": [
    {
     "team": "北京国安",
     "type": "denied_goal",
     "swing": 1,
     "note": "37号被错判犯规且鸣哨时机不当，进球无法追认"
    }
   ]
  },
  "6": {
   "league": "中乙联赛",
   "round": 2,
   "home": "兰州陇原竞技",
   "away": "长春喜都",
   "issue": 2,
   "case_no": 4,
   "match_note": "",
   "items": [
    {
     "team": "长春喜都",
     "type": "missed_yellow_opponent",
     "swing": 0,
     "note": "兰州陇原竞技39号故意挥臂击打，漏判犯规及红/黄牌"
    }
   ]
  },
  "7": {
   "league": "中甲联赛",
   "round": 3,
   "home": "宁波俱乐部",
   "away": "无锡吴钩",
   "issue": 2,
   "case_no": 5,
   "match_note": "",
   "items": [
    {
     "team": "无锡吴钩",
     "type": "missed_penalty",
     "swing": 0,
     "note": "宁波俱乐部队员罚球区内拉扯犯规，应判点球"
    }
   ]
  },
  "11": {
   "league": "中超联赛",
   "round": 5,
   "home": "北京国安",
   "away": "成都蓉城",
   "issue": 3,
   "case_no": 4,
   "match_note": "",
   "items": [
    {
     "team": "北京国安",
     "type": "missed_yellow_opponent",
     "swing": 0,
     "note": "成都蓉城10号鞋钉踩踏属鲁莽犯规，漏判黄牌"
    }
   ]
  },
  "15": {
   "league": "中超联赛",
   "round": 5,
   "home": "深圳新鹏城",
   "away": "云南玉昆",
   "issue": 3,
   "case_no": 8,
   "match_note": "",
   "items": [
    {
     "team": "深圳新鹏城",
     "type": "missed_penalty",
     "swing": 0,
     "note": "云南玉昆34号手臂扩张不自然扩大触球，漏判手球和点球"
    }
   ]
  },
  "16": {
   "league": "中甲联赛",
   "round": 4,
   "home": "长春亚泰",
   "away": "陕西联合",
   "issue": 3,
   "case_no": 9,
   "match_note": "",
   "items": [
    {
     "team": "陕西联合",
     "type": "missed_penalty",
     "swing": 0,
     "note": "长春亚泰队员罚球区内草率绊倒对方，应判点球"
    }
   ]
  },
  "17": {
   "league": "中甲联赛",
   "round": 4,
   "home": "大连鲲城",
   "away": "延边龙鼎",
   "issue": 3,
   "case_no": 10,
   "match_note": "",
   "items": [
    {
     "team": "大连鲲城",
     "type": "missed_penalty",
     "swing": 0,
     "note": "延边龙鼎队员手臂上扬不自然扩大触球，应判点球"
    }
   ]
  },
  "19": {
   "league": "中甲联赛",
   "round": 4,
   "home": "石家庄功夫",
   "away": "佛山南狮",
   "issue": 3,
   "case_no": 12,
   "match_note": "",
   "items": [
    {
     "team": "石家庄功夫",
     "type": "missed_penalty",
     "swing": 0,
     "note": "佛山南狮队员手臂不自然扩大触球，应判点球"
    }
   ]
  },
  "20": {
   "league": "中乙联赛",
   "round": 3,
   "home": "泰安天贶",
   "away": "北京理工",
   "issue": 3,
   "case_no": 13,
   "match_note": "",
   "items": [
    {
     "team": "北京理工",
     "type": "missed_red_opponent",
     "swing": 0,
     "note": "泰安天贶29号铲球使用过分力量属严重犯规，仅黄牌"
    }
   ]
  },
  "22": {
   "league": "中乙联赛",
   "round": 3,
   "home": "泰安天贶",
   "away": "北京理工",
   "issue": 3,
   "case_no": 15,
   "match_note": "",
   "items": [
    {
     "team": "北京理工",
     "type": "missed_yellow_opponent",
     "swing": 0,
     "note": "泰安天贶20号凌空踢触对方躯干属鲁莽犯规，漏判黄牌"
    }
   ]
  },
  "23": {
   "league": "中乙联赛",
   "round": 3,
   "home": "厦门飞鹭",
   "away": "广东铭途",
   "issue": 3,
   "case_no": 16,
   "match_note": "",
   "items": [
    {
     "team": "厦门飞鹭",
     "type": "wrong_penalty_against",
     "swing": 0,
     "note": "防守无犯规动作，对方跑动造成接触，点球错误"
    }
   ]
  },
  "24": {
   "league": "中乙联赛",
   "round": 3,
   "home": "赣州瑞狮",
   "away": "温州俱乐部",
   "issue": 3,
   "case_no": 17,
   "match_note": "",
   "items": [
    {
     "team": "温州俱乐部",
     "type": "missed_penalty",
     "swing": 0,
     "note": "赣州瑞狮26号防守绊倒突破队员，应判点球"
    }
   ]
  },
  "27": {
   "league": "中超联赛",
   "round": 6,
   "home": "青岛海牛",
   "away": "青岛西海岸",
   "issue": 4,
   "case_no": 1,
   "match_note": "",
   "items": [
    {
     "team": "青岛海牛",
     "type": "missed_penalty",
     "swing": 0,
     "note": "青岛西海岸22号铲球犯规，回看后仍维持不判，漏判点球"
    }
   ]
  },
  "37": {
   "league": "中甲联赛",
   "round": 5,
   "home": "无锡吴钩",
   "away": "大连鲲城",
   "issue": 4,
   "case_no": 11,
   "match_note": "",
   "items": [
    {
     "team": "无锡吴钩",
     "type": "opp_goal_should_disallow",
     "swing": -1,
     "note": "双方均有队员提前进入罚球区，应重罚点球而非判补射进球有效"
    }
   ]
  },
  "39": {
   "league": "中甲联赛",
   "round": 5,
   "home": "石家庄功夫",
   "away": "定南赣联",
   "issue": 4,
   "case_no": 13,
   "match_note": "",
   "items": [
    {
     "team": "石家庄功夫",
     "type": "denied_goal",
     "swing": 1,
     "note": "7号未越位，助理裁判员误判致进球被吹无效"
    }
   ]
  },
  "40": {
   "league": "中乙联赛",
   "round": 4,
   "home": "江西庐山",
   "away": "贵州贵阳竞技",
   "issue": 4,
   "case_no": 14,
   "match_note": "",
   "items": [
    {
     "team": "贵州贵阳竞技",
     "type": "wrong_penalty_against",
     "swing": 0,
     "note": "44号手球地点在罚球区外，应判直接任意球而非点球"
    }
   ]
  },
  "42": {
   "league": "中乙联赛",
   "round": 4,
   "home": "长春喜都",
   "away": "泰安天贶",
   "issue": 4,
   "case_no": 16,
   "match_note": "",
   "items": [
    {
     "team": "泰安天贶",
     "type": "wrong_offside_self",
     "swing": 0,
     "note": "33号未越位被误判，进攻被终止"
    }
   ]
  },
  "44": {
   "league": "中乙联赛",
   "round": 4,
   "home": "兰州陇原竞技",
   "away": "山东泰山B队",
   "issue": 4,
   "case_no": 18,
   "match_note": "",
   "items": [
    {
     "team": "山东泰山B队",
     "type": "missed_red_opponent",
     "swing": 0,
     "note": "兰州陇原竞技17号铲球属严重犯规，仅判犯规无牌"
    }
   ]
  },
  "45": {
   "league": "中乙联赛",
   "round": 4,
   "home": "武汉三镇B队",
   "away": "成都蓉城B队",
   "issue": 4,
   "case_no": 19,
   "match_note": "",
   "items": [
    {
     "team": "成都蓉城B队",
     "type": "wrong_penalty_against",
     "swing": 0,
     "note": "45号防守先触球无附加动作，不犯规，点球错误"
    }
   ]
  },
  "47": {
   "league": "中超联赛",
   "round": 7,
   "home": "深圳新鹏城",
   "away": "北京国安",
   "issue": 5,
   "case_no": 1,
   "match_note": "",
   "items": [
    {
     "team": "北京国安",
     "type": "missed_red_opponent",
     "swing": 0,
     "note": "深圳新鹏城36号鞋钉踩踏跟腱且二次踩踏属严重犯规，仅黄牌"
    }
   ]
  },
  "51": {
   "league": "中超联赛",
   "round": 8,
   "home": "北京国安",
   "away": "天津津门虎",
   "issue": 5,
   "case_no": 5,
   "match_note": "",
   "items": [
    {
     "team": "北京国安",
     "type": "missed_yellow_opponent",
     "swing": 0,
     "note": "天津津门虎5号前脚掌蹬踏小腿属鲁莽犯规，漏判黄牌"
    }
   ]
  },
  "57": {
   "league": "中乙联赛",
   "round": 5,
   "home": "上海赛更达",
   "away": "大连可为",
   "issue": 5,
   "case_no": 11,
   "match_note": "",
   "items": [
    {
     "team": "大连可为",
     "type": "missed_yellow_opponent",
     "swing": 0,
     "note": "上海赛更达队员背后草率绊倒且破坏有希望进攻，漏判犯规、任意球和黄牌"
    }
   ]
  },
  "58": {
   "league": "中乙联赛",
   "round": 5,
   "home": "江西庐山",
   "away": "湖北青年星",
   "issue": 5,
   "case_no": 12,
   "match_note": "",
   "items": [
    {
     "team": "江西庐山",
     "type": "missed_penalty",
     "swing": 0,
     "note": "湖北青年星14号过度拉扯抱摔，应判点球"
    },
    {
     "team": "江西庐山",
     "type": "missed_yellow_opponent",
     "swing": 0,
     "note": "该抱摔属鲁莽犯规，应出示黄牌"
    }
   ]
  },
  "59": {
   "league": "中乙联赛",
   "round": 5,
   "home": "海门珂缔缘",
   "away": "北京理工",
   "issue": 5,
   "case_no": 13,
   "match_note": "",
   "items": [
    {
     "team": "海门珂缔缘",
     "type": "opp_goal_should_disallow",
     "swing": -1,
     "note": "北京理工6号越位位置干扰对方队员，进球应无效"
    }
   ]
  },
  "62": {
   "league": "中超联赛",
   "round": 9,
   "home": "天津津门虎",
   "away": "武汉三镇",
   "issue": 6,
   "case_no": 1,
   "match_note": "",
   "items": [
    {
     "team": "天津津门虎",
     "type": "missed_penalty",
     "swing": 0,
     "note": "武汉三镇19号踢倒31号属鲁莽犯规，应判点球"
    },
    {
     "team": "天津津门虎",
     "type": "missed_yellow_opponent",
     "swing": 0,
     "note": "该犯规应出示黄牌"
    }
   ]
  },
  "65": {
   "league": "中甲联赛",
   "round": 7,
   "home": "定南赣联",
   "away": "陕西联合",
   "issue": 6,
   "case_no": 4,
   "match_note": "",
   "items": [
    {
     "team": "定南赣联",
     "type": "wrong_penalty_against",
     "swing": 0,
     "note": "守门员出击触球无附加动作，不犯规，点球错误"
    }
   ]
  },
  "67": {
   "league": "中乙联赛",
   "round": 6,
   "home": "赣州瑞狮",
   "away": "厦门飞鹭",
   "issue": 6,
   "case_no": 6,
   "match_note": "",
   "items": [
    {
     "team": "厦门飞鹭",
     "type": "wrong_red_self",
     "swing": 0,
     "note": "15号腿部下落接触属鲁莽犯规，红牌错误、应黄牌"
    }
   ]
  },
  "68": {
   "league": "中乙联赛",
   "round": 6,
   "home": "成都蓉城希拉谷",
   "away": "杭州临平吴越",
   "issue": 6,
   "case_no": 7,
   "match_note": "",
   "items": [
    {
     "team": "杭州临平吴越",
     "type": "wrong_penalty_against",
     "swing": 0,
     "note": "4号先触球并收脚躲避，不犯规，点球错误"
    }
   ]
  },
  "69": {
   "league": "中乙联赛",
   "round": 6,
   "home": "成都蓉城希拉谷",
   "away": "杭州临平吴越",
   "issue": 6,
   "case_no": 8,
   "match_note": "",
   "items": [
    {
     "team": "杭州临平吴越",
     "type": "denied_goal",
     "swing": 1,